{
  "$schema": "./exchangeRatesSchema.json",
  "version": 1,
  "lastUpdated": "2024-12-06T00:00:00Z",
  "tokens": {
    "USDC": 1.0,
    "USDT": 1.0,
    "FLR": 0.02,
    "WFLR": 0.02
  },
  "chains": {
    "1": {
      "chainId": 1,
      "name": "Ethereum",
      "nativeSymbol": "ETH",
      "usdPrice": 2000
    },
    "56": {
      "chainId": 56,
      "name": "BNB Chain",
      "nativeSymbol": "BNB",
      "usdPrice": 300
    },
    "137": {
      "chainId": 137,
      "name": "Polygon",
      "nativeSymbol": "MATIC",
      "usdPrice": 0.8
    },
    "43114": {
      "chainId": 43114,
      "name": "Avalanche",
      "nativeSymbol": "AVAX",
      "usdPrice": 25
    },
    "42161": {
      "chainId": 42161,
      "name": "Arbitrum",
      "nativeSymbol": "ETH",
      "usdPrice": 2000
    },
    "10": {
      "chainId": 10,
      "name": "Optimism",
      "nativeSymbol": "ETH",
      "usdPrice": 2000
    },
    "14": {
      "chainId": 14,
      "name": "Flare",
      "nativeSymbol": "FLR",
      "usdPrice": 0.02
    },
    "114": {
      "chainId": 114,
      "name": "Coston2",
      "nativeSymbol": "C2FLR",
      "usdPrice": 0.02
    }
  }
}
